{
    "server_port": 8999,
    "site_key_file": "./config/sitekey",
    "ssl_info": {
        "ssl_enabled": true,
        "ssl_cert": "./config/server.crt",
        "ssl_key": "./config/server.key"
    },
    "ca_server_port": 8081,
    "root_ca_file": "./config/rootca.der",
    "event_subscription_info": {
        "gateway_events": true,
        "edgedevice_events": true
    }
}